{
  "schemaVersion": "0.3.0",
  "lenses": [
    "architecture",
    "data-flow"
  ],
  "map": {
    "rename": [
      {
        "match": "functions/src/broadcast/sendBroadcastBulk.ts",
        "to": "Broadcast sender"
      }
    ],
    "exclude": [
      "**/*.test.ts",
      "functions/src/legacy/**"
    ],
    "lane": [
      {
        "match": "packages/broadcast-lib/**",
        "lane": "functions"
      }
    ],
    "group": [
      {
        "match": "id:build-bulk-payload",
        "group": "broadcast-lib"
      }
    ]
  },
  "branding": true,
  "glossary": "docs/CONTEXT.md#Language",
  "github": {
    "comment": {
      "collapsed": false,
      "notice": true
    },
    "draw": "auto",
    "description": true
  }
}
